document,paragraph_index,original_text,n_tokens,n_tokens_all,n_chars,n_chars_all,n_syllables,n_words,n_unique_lemmas,n_sentences,n_other,n_nouns,n_verbs,n_number,n_symbols,n_adverbs,n_articles,n_pronouns,n_particles,n_adjectives,n_prepositions,n_proper_nouns,n_punctuations,n_interjections,n_coordinating_conjunctions,n_subordinating_conjunctions,n_active_verbs,n_passive_verbs,ttr,gulpease,flesch_vacca,lexical_density,n_vdb,n_vdb_fo,n_vdb_au,n_vdb_ad,readit_base,readit_lexical,readit_syntactic,readit_global
70da2ae575436d19518deae1ff2125b0,38,"In quest'ottica è stato avviato un nuovo modello di servizio di prossimità che ha come tradizionale prerogativa la presenza attiva di pattuglie appiedate sul territorio con funzioni di presidio e di prevenzione per dare al cittadino un servizio reattivo e non di semplice ascolto, consolidato da un apporto integrato tra le diverse competenze e discipline della P.M. e in continuo adattamento in ragione dei risultati operativi e di nuove esigenze condivise con le rappresentanze dei quartieri cittadini.",78,80,426,428,177,61,55,1,0,22,7,0,0,1,7,1,0,13,21,1,2,0,5,0,4,3,78.2051282051282,38.23076923076923,-19.5,0.5512820512820513,62,55,7,12,0.004,0.9940000000000001,0.0,1.0
70da2ae575436d19518deae1ff2125b0,39,"Attraverso questa modalità di gestione delle segnalazioni si raggiungono finalità diverse, ma tutte ugualmente importanti:
- contatto diretto con le persone stabilendo un rapporto fiduciario;
- presa d'atto reale del problema per cercare tutte le soluzioni possibili coinvolgendo anche più specializzazioni;
- soluzione rapida (ove possibile) o presa in carico dello stesso;
- semplificare la burocrazia nei rapporti con il cittadino",58,69,362,373,148,54,46,5,0,16,7,0,0,4,7,3,0,8,11,0,11,0,2,0,7,0,93.10344827586206,52.44827586206897,28.53793103448276,0.603448275862069,52,45,7,4,0.08800000000000001,1.0,0.9490000000000001,0.991
70da2ae575436d19518deae1ff2125b0,40,"Il rapporto con l'utente, previsto e regolato dalla legge 7 giugno 2000 n. 150, costituisce un punto cardine per instaurare un rapporto di fiducia nell'Istituzione, stabile e continuativo nel tempo.",32,36,165,169,66,29,27,1,0,10,4,3,0,0,4,0,0,3,6,0,4,0,2,0,4,0,90.625,46.8125,39.9375,0.53125,22,20,2,3,0.941,1.0,0.063,1.0
70da2ae575436d19518deae1ff2125b0,41,"Sul sito della Polizia Municipale, www.poliziamunicipale.comune.fi.it, sono pubblicati gli orari e i recapiti delle sedi dislocate sul territorio comunale; qualora si verificassero chiusure temporanee, la cittadinanza è informata attraverso appositi comunicati, oltre che con l'affissione presso ciascuna sede.",39,45,267,273,115,39,32,2,0,11,5,0,0,1,5,1,0,5,7,1,6,0,1,2,1,4,100.0,35.92307692307692,-5.166666666666686,0.5641025641025641,28,23,5,1,1.0,1.0,0.992,1.0
70da2ae575436d19518deae1ff2125b0,42,"Per quanto riguarda la ricezione dell'utenza, è obiettivo dell'organizzazione rendere accoglienti (prive di barriere architettoniche) tutte le sedi, compatibilmente con eventuali vincoli strutturali imposti.",26,31,179,184,69,25,24,1,0,7,3,0,0,1,3,1,0,6,5,0,5,0,0,0,3,0,96.15384615384616,31.692307692307693,7.5,0.6538461538461539,22,15,6,2,0.993,1.0,0.9570000000000001,1.0
70da2ae575436d19518deae1ff2125b0,43,"Costituisce obiettivo permanente dell'organizzazione quello di professionalizzare adeguatamente il personale adibito ai rapporti con il pubblico, sia presso i front-office che in relazione alla quotidianità di tutti i servizi svolti.",32,35,201,204,80,29,27,1,0,9,3,0,0,2,5,1,0,2,8,0,3,0,1,1,3,0,90.625,35.5625,11.5,0.5,21,20,1,2,0.997,1.0,1.0,1.0
70da2ae575436d19518deae1ff2125b0,44,"Presso il call-center del Comune di Firenze, al numero 055055, è possibile ottenere informazioni relative alla Polizia Municipale.",19,23,109,113,47,19,18,2,0,7,2,1,0,0,1,0,0,3,5,1,3,0,0,0,2,0,100.0,63.21052631578947,35.71052631578945,0.631578947368421,10,10,0,1,0.667,1.0,0.013000000000000001,0.233
70da2ae575436d19518deae1ff2125b0,45,Gli indirizzi e-mail direz.pol.municipale@comune.fi.it e direz.pol.municipale@pec.comune.fi.it sono finalizzati al contatto diretto con la Polizia Municipale per le questioni generali e per tutte quelle a cui non è stata trovata risposta dopo aver consultato la presente carta dei servizi.,38,39,251,252,102,35,31,1,0,10,7,0,0,1,5,2,0,4,6,0,1,0,2,1,2,5,92.10526315789474,30.842105263157897,-6.473684210526301,0.5789473684210527,32,31,1,3,1.0,1.0,0.292,1.0
70da2ae575436d19518deae1ff2125b0,46,"È stato istituito il numero breve, 055.3285, da utilizzare quale numero unico per il Pronto Intervento.",16,19,85,88,33,14,13,1,0,3,4,0,0,0,3,0,0,3,2,1,3,0,0,0,1,3,87.5,54.625,55.9375,0.625,14,14,0,0,0.316,1.0,0.21899999999999997,0.021
70da2ae575436d19518deae1ff2125b0,47,Perseguono finalità comunicative gli appositi comunicati stampa rivolti ai giornali locali e lettere informative.,14,15,99,100,45,14,14,1,0,6,1,0,0,0,1,0,0,4,1,0,1,0,1,0,1,0,100.0,39.714285714285715,-16.928571428571445,0.7857142857142857,10,7,3,1,0.305,1.0,0.025,0.166
70da2ae575436d19518deae1ff2125b0,48,"Il cittadino si rivolge alle diverse aree della Polizia Municipale per effettuare una segnalazione, per ricevere informazioni o atti che lo riguardano. Tutte le richieste dovranno contenere o un recapito telefonico o un indirizzo di posta elettronica dove ricevere le comunicazioni conseguenti.",42,45,250,253,109,36,34,2,0,11,7,0,0,1,8,3,0,4,5,0,3,0,3,0,7,0,85.71428571428571,43.76190476190476,16.309523809523796,0.5476190476190477,38,36,2,4,0.848,1.0,0.002,0.008
70da2ae575436d19518deae1ff2125b0,49,"Si precisa che non verrà dato seguito a quesiti reiterati, pretestuosi o privi di fondamento. Inoltre, alle richieste indirizzate ad organi superiori o ad altri uffici della medesima pubblica amministrazione (es: Sindaco, Assessore, URP, ecc.) non saranno riscontrate direttamente al cittadino ma all'organo o ufficio interpellato.",47,57,276,286,117,43,38,2,0,12,6,0,0,5,0,1,0,8,8,2,10,0,4,1,2,4,91.48936170212765,43.04255319148936,20.69148936170211,0.6595744680851063,35,29,6,7,0.9209999999999999,1.0,0.995,1.0
70da2ae575436d19518deae1ff2125b0,50,Diversamente le richieste indirizzate ad un organo esterno alla Pubblica Amministrazione e alla Polizia Municipale saranno riscontrate tanto al cittadino che all'organo esterno.,24,25,154,155,64,21,19,1,0,6,3,0,0,2,2,1,0,3,5,1,1,0,1,0,1,2,87.5,37.333333333333336,8.666666666666657,0.5833333333333334,19,16,3,2,0.97,1.0,0.1,1.0
70da2ae575436d19518deae1ff2125b0,51,Nelle pagine seguenti si riportano i tempi massimi di risposta che la Polizia Municipale intende garantire.,16,17,91,92,40,16,15,1,0,4,3,0,0,0,2,1,0,3,2,0,1,0,0,1,3,0,100.0,50.875,27.5,0.625,14,14,0,1,0.382,1.0,0.0,0.237
70da2ae575436d19518deae1ff2125b0,52,"Nei casi di sciopero o assemblea sindacale, il Corpo Polizia Municipale è tenuto a garantire dei servizi essenziali in conformità con la normativa vigente in materia e gli accordi sindacali.",30,32,159,161,70,29,26,1,0,9,4,0,0,0,3,0,0,4,7,1,2,0,2,0,2,2,96.66666666666667,46.0,24.333333333333314,0.5666666666666667,23,17,6,4,0.946,1.0,0.013999999999999999,1.0
70da2ae575436d19518deae1ff2125b0,53,"I servizi indispensabili, che devono essere mantenuti per tutta la durata dell'astensione, sono i seguenti:
- servizi di guardia alla Casa Comunale e al Comando (non costituisce servizio indispensabile qualsiasi attività di front-office);
- servizio in centrale operativa: la Centrale Operativa dovrà attenersi a disporre del personale esclusivamente per i servizi indispensabili previsti dalla normativa vigente consistenti in: disposizioni dell'Autorità Giudiziaria, rilievo incidenti stradali, servizi sgombraneve;
- servizio a disposizione dell'Autorità Giudiziaria con l'impiego di personale in divisa",80,95,514,529,213,61,51,6,0,28,10,0,0,2,8,1,0,12,18,0,15,0,1,0,7,3,76.25,47.25,19.604166666666664,0.65,63,50,13,6,0.868,0.867,0.9840000000000001,0.9790000000000001
70da2ae575436d19518deae1ff2125b0,54,Per incidenti stradali classificati con codice rosso dal Servizio di Emergenza Sanitaria o con esito mortale (codice 4) entro 15 minuti dalla richiesta;,23,26,127,130,53,21,20,1,0,8,1,2,0,0,0,0,0,4,7,0,3,0,1,0,1,0,91.30434782608695,46.82608695652174,33.217391304347814,0.5652173913043478,18,13,4,3,0.853,1.0,0.0,1.0
70da2ae575436d19518deae1ff2125b0,55,per incidenti stradali con ferito fino a codice giallo con blocco della circolazione o grave impatto sulla viabilità con impatto sulla circolazione (codice 3) entro 20 minuti dalla richiesta;,29,32,160,163,68,23,23,1,0,11,1,2,0,1,0,0,0,3,10,0,3,0,1,0,1,0,79.3103448275862,44.172413793103445,24.586206896551744,0.5517241379310345,22,15,7,2,0.961,1.0,1.0,1.0
70da2ae575436d19518deae1ff2125b0,56,per spazi di sosta riservati a persone invalide occupati abusivamente entro 45 minuti dalla richiesta.,15,16,87,88,38,15,15,1,0,5,1,1,0,1,0,0,0,2,5,0,1,0,0,0,1,0,100.0,51.0,26.333333333333314,0.6,11,9,1,3,0.303,1.0,0.978,1.0
70da2ae575436d19518deae1ff2125b0,57,"Il soggetto che desidera fare richiesta di accesso agli atti deve contattare preventivamente l'Ufficio Infortunistica Stradale
- tramite e-mail a: pm.richiesteincidenti@comune.fi.it;
- telefonicamente ai numeri 055 3283468, 055 3283469, 055 3283470",30,36,212,218,81,28,26,2,0,8,4,6,0,2,2,1,0,1,5,1,6,0,0,0,4,0,93.33333333333333,38.333333333333336,15.5,0.5,17,16,2,2,0.045,1.0,0.284,0.731
70da2ae575436d19518deae1ff2125b0,58,"L'attività del Front Office Unico (Via delle Cascine, 9) relativa alla visione ed al rilascio di documenti agli aventi diritto (intestatari) o delegati in relazione a verbali di accertamento di violazioni amministrative e a verbali che hanno dato origine all'emissione di cartelle esattoriali e ingiunzioni fiscali, si esplica con le modalità sotto meglio specificate e con possibilità di accesso telematico ovvero di persona.",65,72,357,364,154,55,48,1,0,20,4,1,0,1,2,2,0,7,18,4,7,0,6,0,4,0,84.61538461538461,38.69230769230769,-13.0,0.49230769230769234,48,40,8,13,0.601,1.0,1.0,1.0
70da2ae575436d19518deae1ff2125b0,59,"Si precisa che in tutti i casi in cui gli atti richiesti non siano immediatamente disponibili, saranno a disposizione dell'avente diritto a partire dal 25° giorno dalla ricezione della richiesta e qualora sia impossibile rispettare il termine suddetto, sarà cura dell'ufficio avvisare gli interessati tramite comunicazione telefonica o e-mail.",51,54,292,295,124,47,40,1,0,12,10,1,0,2,5,2,0,5,10,0,3,0,2,2,10,0,92.15686274509804,37.627450980392155,-3.0392156862745026,0.5686274509803921,42,39,3,4,0.992,1.0,1.0,1.0
70da2ae575436d19518deae1ff2125b0,60,"l'avente diritto o il suo delegato recatisi di persona allo sportello di norma accedono immediatamente al servizio mediante presa visione degli atti; se l'atto non è disponibile, è formalizzata richiesta scritta.",33,36,179,182,77,30,27,2,0,10,6,0,0,2,4,0,0,3,6,0,3,0,1,1,4,2,90.9090909090909,52.93939393939394,37.833333333333314,0.6363636363636364,27,22,5,3,0.966,1.0,0.527,1.0
70da2ae575436d19518deae1ff2125b0,61,"si accede al servizio tramite richiesta scritta dell'avente diritto o di un suo delegato; se l'atto non è immediatamente disponibile, sarà a disposizione dell'avente diritto a partire dal 25° giorno dalla ricezione della richiesta.",37,40,195,198,80,32,29,2,0,10,6,1,0,2,3,1,0,2,10,0,3,0,1,1,6,0,86.48648648648648,52.513513513513516,46.95945945945945,0.5405405405405406,29,26,3,4,0.971,1.0,0.584,0.9640000000000001
70da2ae575436d19518deae1ff2125b0,62,"Le immagini possono essere visionate dall'avente diritto accedendo direttamente dalla rete civica del Comune di Firenze pertanto, l'avente diritto o il suo delegato accede immediatamente al servizio; se per qualsiasi motivo non sia possibile la visione deve essere formalizzata richiesta scritta.",43,46,253,256,107,40,35,2,0,10,11,0,0,4,6,0,0,3,6,1,3,0,1,1,5,6,93.02325581395348,44.116279069767444,22.75581395348837,0.6511627906976745,34,29,5,2,0.997,1.0,0.052000000000000005,1.0
70da2ae575436d19518deae1ff2125b0,63,Le immagini possono essere visionate dall'avente diritto accedendo direttamente dalla rete civica del Comune di Firenze; se per qualsiasi motivo non sia possibile la visione deve essere formalizzata richiesta scritta.,31,33,186,188,78,30,27,2,0,7,9,0,0,2,3,0,0,3,5,1,2,0,0,1,3,6,96.7741935483871,48.354838709677416,26.951612903225794,0.6774193548387096,23,21,2,1,0.991,1.0,0.255,1.0
70da2ae575436d19518deae1ff2125b0,64,"Normalmente l'avente diritto o il suo delegato accede immediatamente al servizio, se per qualsiasi motivo non sia possibile, per il rilascio delle copie delle immagini deve essere formalizzata richiesta scritta.",31,34,179,182,74,28,27,1,0,8,6,0,0,3,5,0,0,2,5,0,3,0,1,1,3,3,90.32258064516128,40.935483870967744,19.83870967741933,0.6129032258064516,26,22,4,1,0.985,1.0,0.0,0.0
70da2ae575436d19518deae1ff2125b0,65,il rilascio di copie di atti e documenti da parte della Polizia Municipale è subordinato al preventivo pagamento del rimborso spese determinato con Delibera della Giunta Municipale n. 384/261 del 20.05.2003 oltre alle eventuali spese di spedizione postale.,38,39,218,219,89,32,31,1,0,15,2,1,0,1,2,0,0,6,10,0,1,0,1,0,0,2,84.21052631578947,39.526315789473685,15.76315789473685,0.631578947368421,23,20,3,4,0.9940000000000001,1.0,1.0,1.0
70da2ae575436d19518deae1ff2125b0,66,"I cittadini possono presentare segnalazioni relative allo spazio pubblico e gestito con manutenzioni ordinarie, oppure relative a problemi inerenti al degrado per i quali possa intervenire la Polizia Municipale (a titolo esemplificativo piccole manutenzioni all'arredo urbano o al verde pubblico, abbandono di relitti o di rifiuti) e fare proposte per migliorare l'impatto ambientale e la percezione della sicurezza.",60,65,354,359,156,49,43,1,0,17,7,0,0,0,5,1,0,12,12,0,5,0,6,0,7,0,81.66666666666667,35.0,-23.00000000000003,0.6,48,40,8,9,0.986,0.997,1.0,1.0
70da2ae575436d19518deae1ff2125b0,67,"Il monitoraggio e la misurazione della qualità delle prestazioni erogate, costituisce al tempo stesso strumento e momento imprescindibile per valutare l'efficacia e l'efficienza dei servizi alla cittadinanza. A questo proposito sono stati identificati, in relazione a tutte le aree, gli indicatori di processo finalizzati a misurarne il trend. In collaborazione con l'Ufficio Statistica dell'Amministrazione Comunale, è stato individuato uno strumento d'indagine, rivolto a verificare la qualità percepita dagli utenti, identificando un campione rappresentativo della Città di Firenze. È obiettivo della Polizia Municipale ripetere periodicamente questo genere di iniziativa, sia per avere un feedback sul livello di qualità percepita dai cittadini in merito ai servizi erogati, sia per individuare le aree di miglioramento che possono essere implementate.",121,133,729,741,308,95,72,4,0,38,22,0,0,1,16,1,0,7,29,2,12,0,5,0,13,9,78.51239669421489,38.66942148760331,10.295454545454533,0.5619834710743802,95,85,9,14,0.99,0.9840000000000001,0.98,1.0
70da2ae575436d19518deae1ff2125b0,68,"Il reclamo costituisce lo strumento più diretto e di facile utilizzazione, che il cittadino può inoltrare nei confronti del Corpo di Polizia Municipale.",23,25,128,130,52,22,20,1,0,7,3,0,0,1,3,0,0,3,4,0,2,0,1,1,3,0,95.65217391304348,46.391304347826086,36.04347826086956,0.6086956521739131,16,15,0,4,0.862,1.0,0.5379999999999999,0.015
70da2ae575436d19518deae1ff2125b0,69,"Il reclamo sia esso formale o informale, assolve ad una funzione di prevenzione del contenzioso ed è fondamentale per adottare tutte le azioni correttive necessarie qualora si rilevi la fondatezza del reclamo proposto.",33,35,184,186,76,31,28,1,0,7,5,0,0,0,5,2,0,6,5,0,2,0,2,1,5,0,93.93939393939394,42.333333333333336,23.303030303030283,0.5454545454545454,27,20,6,6,0.982,1.0,0.006999999999999999,1.0
70da2ae575436d19518deae1ff2125b0,70,Il reclamo informale è di tipo verbale.,7,8,32,33,15,7,7,1,0,2,1,0,0,0,1,0,0,2,1,0,1,0,0,0,1,0,100.0,86.14285714285714,59.71428571428572,0.7142857142857143,6,5,0,2,0.01,1.0,0.003,0.225
70da2ae575436d19518deae1ff2125b0,71,"Il reclamo formale è proposto per iscritto, anche utilizzando apposito modulo prestampato, presentando una lettera direttamente presso le sedi aperte al pubblico o inviandola per posta, fax o mail, oppure tramite gli uffici dell'URP.",35,40,195,200,78,33,31,1,0,10,6,0,0,2,4,0,0,3,6,1,5,0,3,0,4,2,94.28571428571428,41.857142857142854,26.14285714285714,0.6,29,23,5,3,0.982,1.0,0.063,1.0
70da2ae575436d19518deae1ff2125b0,72,"Il reclamo viene analizzato dal Commissario titolare di Posizione Organizzativa di riferimento, il quale si accerta della fondatezza dello stesso e propone la risposta scritta (o la motivazione di non accoglimento), al Comandante per ulteriore verifica, il quale provvede a trasmetterlo al cittadino in un tempo massimo di 30 giorni dalla presentazione del reclamo stesso.",55,61,312,318,131,46,41,1,0,16,6,1,0,1,6,4,0,5,14,0,6,0,2,0,4,2,83.63636363636363,37.72727272727273,-3.8181818181818414,0.509090909090909,42,32,8,9,0.968,0.9790000000000001,1.0,1.0
70da2ae575436d19518deae1ff2125b0,73,"Nel caso in cui il reclamo non riguardi il Corpo di Polizia Municipale, ma risulti relativo alla attività di un'altra Direzione, di Ente esterno erogante un servizio pubblico, o di una partecipata dell'Amministrazione Comunale, questo verrà inoltrato entro 3 giorni al destinatario. Sono disponibili i moduli prestampati finalizzati ad agevolare l'esposizione del reclamo o della segnalazione; di seguito si riportano i modelli.",65,72,360,367,154,57,50,3,0,18,8,1,0,1,8,3,0,9,14,0,7,0,3,0,6,2,87.6923076923077,47.46153846153846,30.333333333333332,0.5538461538461539,47,41,4,10,0.9790000000000001,1.0,1.0,1.0
70da2ae575436d19518deae1ff2125b0,74,"Al fine di migliorare costantemente gli standard di efficacia ed efficienza assicurati al cittadino, la Carta dei Servizi viene periodicamente rivista, di regola una volta all'anno, per assicurare la continua adeguatezza ai bisogni della collettività ed alle regole interne dell'organizzazione.",42,46,251,255,105,38,29,1,0,14,5,0,0,2,4,0,0,2,12,1,4,0,2,0,3,2,90.47619047619048,36.38095238095238,1.5,0.5476190476190477,29,25,5,5,1.0,1.0,1.0,1.0
99bdc9fdd8097f067f77cb220074b1b5,1,"Le presenti Linee programmatiche definiscono gli indirizzi per la programmazione regionale, stabilendo le linee di azione e organizzative prioritarie per il Sistema sanitario regionale attuazione della riforma territoriale ai sensi del DM 23 maggio 2022, n. 77. Tali linee programmatiche, che devono essere declinate nella programmazione attuativa aziendale non si intendono esaustive delle attività e dei servizi che devono essere garantiti in adempimento della normativa statale e regionale, ma indicano le priorità individuate dalla Regione. Il presente documento indirizza le funzionalità, i modelli organizzativi e di servizio, i mix di professionalità necessari per il concreto avvio delle Case di Comunità (CdC), Ospedali di Comunità (OdC), Centrali Operative Territoriali (COT), Infermiere di Famiglia e Comunità (IFeC), Assistenza Domiciliare Integrata (ADI) e tutte le altre componenti rilevanti per lo sviluppo dei servizi territoriali per promuovere la prevenzione primaria, migliorare l'accessibilità, in modo particolare quelli affetti da patologie croniche e dell'area della fragilità, in coerenza anche con le previsioni del PNRR, dell'evoluzione dell'ecosistema digitale e del modello di governance dell'area della fragilità e della cronicità realizzando un quadro organico ed armonico di evoluzione del Sistema Socio Sanitario Regionale SSSR. ",191,218,1148,1175,479,136,117,3,0,55,15,3,0,2,19,4,0,33,38,11,27,0,11,0,9,6,71.20418848167539,33.60732984293194,-20.677137870855155,0.5497382198952879,127,95,32,19,0.983,0.943,1.0,1.0
99bdc9fdd8097f067f77cb220074b1b5,2,"La situazione demografica, sanitaria, socio-economica e tecnologica della Regione Basilicata e, in una scala maggiore dell'intero Paese, è profondamente cambiata. La pandemia e le crisi socio-economiche hanno ovunque acuito le diseguaglianze e hanno evidenziato che la resilienza dei sistemi organizzati di welfare deve essere irrobustita dal punto di vista del finanziamento, dell'organizzazione a rete, del rispetto delle esigenze dei territori, del ruolo e del protagonismo degli operatori e dei cittadini in un'ottica di comunità, specialmente in un contesto di progressivo invecchiamento della popolazione e di aumentata prevalenza di malattie croniche. Le tecnologie mediche ed informatiche offrono nuove opportunità di cura e assistenza che richiedono competenze, lavoro di equipe, semplificazione organizzativa, anche in ottica di revisione continua dei processi.",123,139,738,754,309,91,78,3,0,41,11,0,0,4,9,1,0,17,29,1,16,0,9,1,8,3,73.98373983739837,36.31707317073171,1.7073170731707137,0.5934959349593496,92,73,20,19,1.0,0.975,1.0,1.0
99bdc9fdd8097f067f77cb220074b1b5,3,"L'analisi di contesto della popolazione residente in Basilicata evidenzia come la popolazione anziana (over 65) rappresenti il 23% della popolazione totale nella Regione, percentuale in linea con la media nazionale ",31,35,181,185,77,26,24,1,0,9,2,2,1,0,4,0,0,4,7,2,3,0,0,1,2,0,83.87096774193549,40.29032258064516,13.548387096774206,0.4838709677419355,24,20,5,1,0.988,1.0,0.598,1.0
99bdc9fdd8097f067f77cb220074b1b5,4,"La Basilicata ha una superficie di 10.073 kmq con 553.254 abitanti (2019) distribuiti su 131 Comuni, per una densità pari a 54,92 abitanti per kmq. di gran lunga inferiore alla densità media nazionale che è 200 abitanti per kmq. L'età media è 45,7 anni contro i 45, dell'Italia. Il confronto con i dati del Censimento 2011 evidenzia un progressivo invecchiamento della popolazione, con ritmi superiori alla media nazionale. Tutte le classi di età sotto i 50 anni vedono diminuire il proprio peso relativo rispetto al 2011. L'indice di vecchiaia è 200,8; la percentuale della popolazione ultrasessantacinquenne è 23,9%. La rete dei servizi territoriali è governata tramite due Aziende Sanitarie, ASP e ASM. Il territorio dell'Azienda Sanitaria di Potenza (ASP) coincide con quello dell'intera provincia e ha una superficie di 6.546 Kmq suddivisa in 100 comuni nei quali è distribuita una popolazione complessiva di circa 358.000 abitanti (di questi 66.393 concentrati nel comune di Potenza); l'indice di vecchiaia è 207,4, significativamente più alto rispetto al dato regionale e alla provincia di Matera (che si attesta a 189,4). Il territorio della Azienda Sanitaria di Matera (ASM) ha una superficie di 3.527 kmq suddivisa in 31 Comuni con una popolazione complessiva di circa 195.000 abitanti (rif. prospetto 1). ",211,241,1081,1111,430,127,110,11,0,50,20,26,1,6,26,5,0,22,43,10,29,0,3,0,16,4,60.18957345971564,53.40758293838863,54.35372684187848,0.46445497630331756,141,123,19,19,0.868,0.529,0.386,0.71
99bdc9fdd8097f067f77cb220074b1b5,5,Molto interessante è l'aspetto della tendenza demografica degli ultimi 70 anni in particolare in termini di spopolamento di alcune aree territoriali che deve far riflettere sulla modalità di configurazione della Case della Comunità e sulle opportunità offerte dalle nuove tecnologie per tenere in rete cittadini che vivono sparsi sul territorio. ,51,52,295,296,127,44,41,1,0,14,8,1,0,1,2,2,0,5,15,2,1,0,1,0,8,0,86.27450980392157,37.03921568627451,-6.862745098039227,0.5490196078431373,37,33,4,4,0.9940000000000001,1.0,1.0,1.0
99bdc9fdd8097f067f77cb220074b1b5,6,"Se guardiamo alla tendenza demografica dei comuni e alla piramide d'età del nostro territorio ne desumiamo sicuramente un'esigenza fondamentale sul fronte dei servizi: o la Regione Basilicata investe sui servizi di territorio con innovazione, incremento delle numerosità e varietà di servizi e capacità di governo o uscirà sconfitta dalla evoluzione naturale delle cose. ",55,58,315,318,136,44,40,2,0,21,4,0,0,1,3,1,0,3,15,1,3,0,5,1,4,0,80.0,42.63636363636363,17.77272727272728,0.5272727272727272,38,33,5,9,0.987,1.0,0.8759999999999999,0.9540000000000001
99bdc9fdd8097f067f77cb220074b1b5,7,"La tendenza ad un aumento delle condizioni di fragilità psico-fisica della popolazione lucana si conferma anche dall'andamento della percentuale delle persone con Indice di Comorbidità di Charlson (ICC) maggiore o uguale a uno sul totale dei pazienti ricoverati in strutture ospedaliere regionali. Nel periodo 2015-2020 la percentuale di pazienti con ICC >=1 registra, per le province di Potenza e Matera, un aumento rispettivamente di +4,3% e +5,4%. ",72,82,374,384,154,58,52,2,0,17,3,5,2,2,5,2,0,7,20,7,9,0,3,0,3,0,80.55555555555556,45.388888888888886,30.97222222222223,0.4027777777777778,46,39,6,12,0.9690000000000001,0.997,1.0,1.0
99bdc9fdd8097f067f77cb220074b1b5,8,La distribuzione per comune dell'ICC mette in luce la presenza di aree geografiche caratterizzate da una quota elevata di popolazione affetta da patologie croniche.,25,26,140,141,57,23,22,1,0,8,2,0,0,0,3,0,0,4,7,1,1,0,0,0,2,0,92.0,45.0,32.80000000000001,0.56,23,17,6,2,0.92,1.0,0.028999999999999998,1.0
99bdc9fdd8097f067f77cb220074b1b5,9,"Si rende necessario adeguare il livello dell'Assistenza Distrettuale, come definito dal Capo III, art. 3-20, del DPCM LEA 12 gennaio 2017e dal Decreto 23 maggio 2022, n. 77 art. 1 allegato 1 e allegato 2 prescrittivo. ",38,44,176,182,71,34,33,1,0,9,3,10,0,0,1,1,0,4,4,4,6,0,1,1,3,0,89.47368421052632,50.578947368421055,46.55263157894737,0.42105263157894735,17,14,3,1,0.872,1.0,0.975,1.0
